date,season,away_team.x,away_goals,home_team,home_goals,extra_time,attendance,winner,game_status,home_odds,tie_odds,away_odds,location_lon,location_lat,label_content
7/01/2020,2019/2020,Arizona Coyotes,5,Florida Panthers,2,Normal Time,12120,Arizona Coyotes,Played,2.18,4.25,2.9,-80.325378,26.158498,Florida Panthers vs Arizona Coyotes | 2 - 5 Normal Time | Winner: Arizona Coyotes
7/01/2020,2019/2020,Vancouver Canucks,2,Tampa Bay Lightning,9,Normal Time,19092,Tampa Bay Lightning,Played,1.71,4.71,4.25,-82.451804,27.942695,Tampa Bay Lightning vs Vancouver Canucks | 9 - 2 Normal Time | Winner: Tampa Bay Lightning
7/01/2020,2019/2020,Columbus Blue Jackets,4,Anaheim Ducks,3,Normal Time,16153,Columbus Blue Jackets,Played,2.34,4,2.76,-117.876426,33.807714,Anaheim Ducks vs Columbus Blue Jackets | 3 - 4 Normal Time | Winner: Columbus Blue Jackets
7/01/2020,2019/2020,Philadelphia Flyers,4,Carolina Hurricanes,5,OT,15072,Carolina Hurricanes,Played,1.94,4.45,3.3,-78.721967,35.803306,Carolina Hurricanes vs Philadelphia Flyers | 5 - 4 OT | Winner: Carolina Hurricanes
7/01/2020,2019/2020,Pittsburgh Penguins,4,Vegas Golden Knights,3,Normal Time,18298,Pittsburgh Penguins,Played,1.95,4.3,3.45,-115.178408,36.102827,Vegas Golden Knights vs Pittsburgh Penguins | 3 - 4 Normal Time | Winner: Pittsburgh Penguins
7/01/2020,2019/2020,Boston Bruins,6,Nashville Predators,2,Normal Time,17623,Boston Bruins,Played,2.64,4.15,2.39,-86.778458,36.159125,Nashville Predators vs Boston Bruins | 2 - 6 Normal Time | Winner: Boston Bruins
7/01/2020,2019/2020,San Jose Sharks,2,St. Louis Blues,3,Normal Time,18096,St. Louis Blues,Played,1.85,4.4,3.7,-90.202834,38.626798,St. Louis Blues vs San Jose Sharks | 3 - 2 Normal Time | Winner: St. Louis Blues
7/01/2020,2019/2020,Ottawa Setors,1,Washington Capitals,6,Normal Time,18573,Washington Capitals,Played,1.58,5.03,4.8,-77.021903,38.898147,Washington Capitals vs Ottawa Setors | 6 - 1 Normal Time | Winner: Washington Capitals
7/01/2020,2019/2020,Colorado Avalanche,3,New York Rangers,5,Normal Time,17082,New York Rangers,Played,2.95,4.4,2.1,-73.993455,40.750478,New York Rangers vs Colorado Avalanche | 5 - 3 Normal Time | Winner: New York Rangers
7/01/2020,2019/2020,Calgary Flames,2,Chicago Blackhawks,1,Normal Time,21274,Calgary Flames,Played,2.85,4.3,2.2,-87.674192,41.880666,Chicago Blackhawks vs Calgary Flames | 1 - 2 Normal Time | Winner: Calgary Flames
7/01/2020,2019/2020,Montreal Canadiens,3,Detroit Red Wings,4,Normal Time,17538,Detroit Red Wings,Played,3.22,4.35,2,-83.055271,42.341077,Detroit Red Wings vs Montreal Canadiens | 4 - 3 Normal Time | Winner: Detroit Red Wings
8/01/2020,2019/2020,Dallas Stars,2,Los Angeles Kings,1,Normal Time,17129,Dallas Stars,Played,3.08,4.05,2.13,-118.267259,34.043004,Los Angeles Kings vs Dallas Stars | 1 - 2 Normal Time | Winner: Dallas Stars
8/01/2020,2019/2020,Washington Capitals,2,Philadelphia Flyers,3,Normal Time,18595,Philadelphia Flyers,Played,2.79,4.2,2.28,-75.171967,39.90041,Philadelphia Flyers vs Washington Capitals | 3 - 2 Normal Time | Winner: Philadelphia Flyers
8/01/2020,2019/2020,Winnipeg Jets,4,Toronto Maple Leafs,3,SO,19397,Winnipeg Jets,Played,1.78,4.7,3.75,-79.379026,43.64341,Toronto Maple Leafs vs Winnipeg Jets | 3 - 4 SO | Winner: Winnipeg Jets
9/01/2020,2019/2020,Vancouver Canucks,2,Florida Panthers,5,Normal Time,12648,Florida Panthers,Played,2.05,4.4,3.1,-80.325378,26.158498,Florida Panthers vs Vancouver Canucks | 5 - 2 Normal Time | Winner: Florida Panthers
9/01/2020,2019/2020,Arizona Coyotes,0,Tampa Bay Lightning,4,Normal Time,19092,Tampa Bay Lightning,Played,1.72,4.8,4.05,-82.451804,27.942695,Tampa Bay Lightning vs Arizona Coyotes | 4 - 0 Normal Time | Winner: Tampa Bay Lightning
9/01/2020,2019/2020,Dallas Stars,3,Anaheim Ducks,0,Normal Time,15419,Dallas Stars,Played,2.94,3.98,2.28,-117.876426,33.807714,Anaheim Ducks vs Dallas Stars | 0 - 3 Normal Time | Winner: Dallas Stars
9/01/2020,2019/2020,Los Angeles Kings,5,Vegas Golden Knights,2,Normal Time,18281,Los Angeles Kings,Played,1.63,4.8,4.75,-115.178408,36.102827,Vegas Golden Knights vs Los Angeles Kings | 2 - 5 Normal Time | Winner: Los Angeles Kings
9/01/2020,2019/2020,Columbus Blue Jackets,1,San Jose Sharks,3,Normal Time,17085,San Jose Sharks,Played,2.27,4.15,2.85,-121.901304,37.332713,San Jose Sharks vs Columbus Blue Jackets | 3 - 1 Normal Time | Winner: San Jose Sharks
9/01/2020,2019/2020,Buffalo Sabres,1,St. Louis Blues,5,Normal Time,18096,St. Louis Blues,Played,1.78,4.5,3.94,-90.202834,38.626798,St. Louis Blues vs Buffalo Sabres | 5 - 1 Normal Time | Winner: St. Louis Blues
9/01/2020,2019/2020,New Jersey Devils,3,New York Rangers,6,Normal Time,17007,New York Rangers,Played,1.96,4.4,3.28,-73.993455,40.750478,New York Rangers vs New Jersey Devils | 6 - 3 Normal Time | Winner: New York Rangers
9/01/2020,2019/2020,Nashville Predators,5,Chicago Blackhawks,2,Normal Time,21440,Nashville Predators,Played,2.86,4.4,2.15,-87.674192,41.880666,Chicago Blackhawks vs Nashville Predators | 2 - 5 Normal Time | Winner: Nashville Predators
9/01/2020,2019/2020,Winnipeg Jets,4,Boston Bruins,5,Normal Time,17850,Boston Bruins,Played,1.62,4.9,4.65,-71.062106,42.366179,Boston Bruins vs Winnipeg Jets | 5 - 4 Normal Time | Winner: Boston Bruins
9/01/2020,2019/2020,Edmonton Oilers,4,Montreal Canadiens,2,Normal Time,21302,Edmonton Oilers,Played,2.2,4.33,2.83,-73.56945,44.496067,Montreal Canadiens vs Edmonton Oilers | 2 - 4 Normal Time | Winner: Edmonton Oilers
9/01/2020,2019/2020,Minnesota Wild,1,Calgary Flames,2,Normal Time,18634,Calgary Flames,Played,2.07,4.4,3.1,-114.051939,51.037398,Calgary Flames vs Minnesota Wild | 2 - 1 Normal Time | Winner: Calgary Flames
10/01/2020,2019/2020,Arizona Coyotes,0,Carolina Hurricanes,3,Normal Time,16476,Carolina Hurricanes,Played,1.9,4.35,3.55,-78.721967,35.803306,Carolina Hurricanes vs Arizona Coyotes | 3 - 0 Normal Time | Winner: Carolina Hurricanes
10/01/2020,2019/2020,Pittsburgh Penguins,4,Colorado Avalanche,3,OT,18132,Pittsburgh Penguins,Played,2,4.45,3.22,-105.008479,39.74822,Colorado Avalanche vs Pittsburgh Penguins | 3 - 4 OT | Winner: Pittsburgh Penguins
10/01/2020,2019/2020,Ottawa Setors,2,Detroit Red Wings,3,SO,18724,Detroit Red Wings,Played,2.73,4.25,2.27,-83.055271,42.341077,Detroit Red Wings vs Ottawa Setors | 3 - 2 SO | Winner: Detroit Red Wings
11/01/2020,2019/2020,Los Angeles Kings,0,Carolina Hurricanes,2,Normal Time,18680,Carolina Hurricanes,Played,1.75,4.65,3.95,-78.721967,35.803306,Carolina Hurricanes vs Los Angeles Kings | 2 - 0 Normal Time | Winner: Carolina Hurricanes
11/01/2020,2019/2020,Columbus Blue Jackets,3,Vegas Golden Knights,0,Normal Time,18400,Columbus Blue Jackets,Played,1.73,4.6,4.15,-115.178408,36.102827,Vegas Golden Knights vs Columbus Blue Jackets | 0 - 3 Normal Time | Winner: Columbus Blue Jackets
11/01/2020,2019/2020,Dallas Stars,1,San Jose Sharks,2,Normal Time,17562,San Jose Sharks,Played,2.87,4.05,2.25,-121.901304,37.332713,San Jose Sharks vs Dallas Stars | 2 - 1 Normal Time | Winner: San Jose Sharks
11/01/2020,2019/2020,New Jersey Devils,5,Washington Capitals,1,Normal Time,18573,New Jersey Devils,Played,1.51,5.25,5.25,-77.021903,38.898147,Washington Capitals vs New Jersey Devils | 1 - 5 Normal Time | Winner: New Jersey Devils
11/01/2020,2019/2020,Tampa Bay Lightning,1,Philadelphia Flyers,0,Normal Time,19866,Tampa Bay Lightning,Played,2.95,4.35,2.11,-75.171967,39.90041,Philadelphia Flyers vs Tampa Bay Lightning | 0 - 1 Normal Time | Winner: Tampa Bay Lightning
11/01/2020,2019/2020,Boston Bruins,3,New York Islanders,2,OT,14962,Boston Bruins,Played,2.8,4.1,2.28,-73.975334,40.682624,New York Islanders vs Boston Bruins | 2 - 3 OT | Winner: Boston Bruins
11/01/2020,2019/2020,Anaheim Ducks,2,Chicago Blackhawks,4,Normal Time,21548,Chicago Blackhawks,Played,2.28,4.2,2.8,-87.674192,41.880666,Chicago Blackhawks vs Anaheim Ducks | 4 - 2 Normal Time | Winner: Chicago Blackhawks
11/01/2020,2019/2020,Montreal Canadiens,2,Ottawa Setors,1,OT,18088,Montreal Canadiens,Played,2.95,4.5,2.12,-75.927207,45.296899,Ottawa Setors vs Montreal Canadiens | 1 - 2 OT | Winner: Montreal Canadiens
11/01/2020,2019/2020,Edmonton Oilers,3,Calgary Flames,4,Normal Time,19289,Calgary Flames,Played,2.02,4.33,3.21,-114.051939,51.037398,Calgary Flames vs Edmonton Oilers | 4 - 3 Normal Time | Winner: Calgary Flames
12/01/2020,2019/2020,Toronto Maple Leafs,4,Florida Panthers,8,Normal Time,15535,Florida Panthers,Played,2.79,4.35,2.2,-80.325378,26.158498,Florida Panthers vs Toronto Maple Leafs | 8 - 4 Normal Time | Winner: Florida Panthers
12/01/2020,2019/2020,Pittsburgh Penguins,4,Arizona Coyotes,3,SO,13755,Pittsburgh Penguins,Played,2.75,4.2,2.42,-112.261173,33.532977,Arizona Coyotes vs Pittsburgh Penguins | 3 - 4 SO | Winner: Pittsburgh Penguins
12/01/2020,2019/2020,Tampa Bay Lightning,1,New Jersey Devils,3,Normal Time,14203,New Jersey Devils,Played,3.95,4.9,1.75,-74.171058,40.733511,New Jersey Devils vs Tampa Bay Lightning | 3 - 1 Normal Time | Winner: New Jersey Devils
13/01/2020,2019/2020,Anaheim Ducks,1,St. Louis Blues,4,Normal Time,18096,St. Louis Blues,Played,1.68,4.65,4.35,-90.202834,38.626798,St. Louis Blues vs Anaheim Ducks | 4 - 1 Normal Time | Winner: St. Louis Blues
13/01/2020,2019/2020,Carolina Hurricanes,0,Washington Capitals,2,Normal Time,18573,Washington Capitals,Played,2.1,4.4,2.93,-77.021903,38.898147,Washington Capitals vs Carolina Hurricanes | 2 - 0 Normal Time | Winner: Washington Capitals
13/01/2020,2019/2020,Boston Bruins,5,Philadelphia Flyers,6,SO,19246,Philadelphia Flyers,Played,2.95,4.2,2.2,-75.171967,39.90041,Philadelphia Flyers vs Boston Bruins | 6 - 5 SO | Winner: Philadelphia Flyers
13/01/2020,2019/2020,Calgary Flames,0,Montreal Canadiens,2,Normal Time,20790,Montreal Canadiens,Played,2.47,4.25,2.49,-73.56945,44.496067,Montreal Canadiens vs Calgary Flames | 2 - 0 Normal Time | Winner: Montreal Canadiens
14/01/2020,2019/2020,Los Angeles Kings,3,Tampa Bay Lightning,4,SO,19092,Tampa Bay Lightning,Played,1.59,5,4.7,-82.451804,27.942695,Tampa Bay Lightning vs Los Angeles Kings | 4 - 3 SO | Winner: Tampa Bay Lightning
14/01/2020,2019/2020,San Jose Sharks,3,Arizona Coyotes,6,Normal Time,14716,Arizona Coyotes,Played,2.15,4.1,3.05,-112.261173,33.532977,Arizona Coyotes vs San Jose Sharks | 6 - 3 Normal Time | Winner: Arizona Coyotes
14/01/2020,2019/2020,Dallas Stars,3,Colorado Avalanche,2,OT,18015,Dallas Stars,Played,2.12,4.2,3.02,-105.008479,39.74822,Colorado Avalanche vs Dallas Stars | 2 - 3 OT | Winner: Dallas Stars
14/01/2020,2019/2020,Boston Bruins,0,Columbus Blue Jackets,3,Normal Time,17349,Columbus Blue Jackets,Played,3.1,4.05,2.13,-83.006102,39.96904,Columbus Blue Jackets vs Boston Bruins | 3 - 0 Normal Time | Winner: Columbus Blue Jackets
14/01/2020,2019/2020,Minnesota Wild,3,Pittsburgh Penguins,7,Normal Time,18545,Pittsburgh Penguins,Played,1.91,4.35,3.44,-79.989706,40.438823,Pittsburgh Penguins vs Minnesota Wild | 7 - 3 Normal Time | Winner: Pittsburgh Penguins
14/01/2020,2019/2020,Detroit Red Wings,2,New York Islanders,8,Normal Time,12542,New York Islanders,Played,1.65,4.8,4.55,-73.975334,40.682624,New York Islanders vs Detroit Red Wings | 8 - 2 Normal Time | Winner: New York Islanders
14/01/2020,2019/2020,Vegas Golden Knights,2,Buffalo Sabres,4,Normal Time,18257,Buffalo Sabres,Played,3.34,4.7,1.99,-78.876395,42.874951,Buffalo Sabres vs Vegas Golden Knights | 4 - 2 Normal Time | Winner: Buffalo Sabres
14/01/2020,2019/2020,New Jersey Devils,4,Toronto Maple Leafs,7,Normal Time,19124,Toronto Maple Leafs,Played,1.6,5.1,4.6,-79.379026,43.64341,Toronto Maple Leafs vs New Jersey Devils | 7 - 4 Normal Time | Winner: Toronto Maple Leafs
14/01/2020,2019/2020,Chicago Blackhawks,3,Ottawa Setors,2,OT,12238,Chicago Blackhawks,Played,2.39,4.35,2.53,-75.927207,45.296899,Ottawa Setors vs Chicago Blackhawks | 2 - 3 OT | Winner: Chicago Blackhawks
14/01/2020,2019/2020,Vancouver Canucks,0,Winnipeg Jets,4,Normal Time,15325,Winnipeg Jets,Played,2.25,4.3,2.76,-97.143754,49.89259,Winnipeg Jets vs Vancouver Canucks | 4 - 0 Normal Time | Winner: Winnipeg Jets
14/01/2020,2019/2020,Nashville Predators,2,Edmonton Oilers,4,Normal Time,17029,Edmonton Oilers,Played,2.65,4.33,2.37,-113.498029,53.546977,Edmonton Oilers vs Nashville Predators | 4 - 2 Normal Time | Winner: Edmonton Oilers
15/01/2020,2019/2020,Philadelphia Flyers,4,St. Louis Blues,3,OT,18096,Philadelphia Flyers,Played,1.84,4.4,3.65,-90.202834,38.626798,St. Louis Blues vs Philadelphia Flyers | 3 - 4 OT | Winner: Philadelphia Flyers
15/01/2020,2019/2020,Chicago Blackhawks,4,Montreal Canadiens,1,Normal Time,21302,Chicago Blackhawks,Played,1.97,4.2,3.45,-73.56945,44.496067,Montreal Canadiens vs Chicago Blackhawks | 1 - 4 Normal Time | Winner: Chicago Blackhawks
16/01/2020,2019/2020,Los Angeles Kings,3,Florida Panthers,4,Normal Time,12575,Florida Panthers,Played,1.9,4.4,3.46,-80.325378,26.158498,Florida Panthers vs Los Angeles Kings | 4 - 3 Normal Time | Winner: Florida Panthers
16/01/2020,2019/2020,Buffalo Sabres,4,Dallas Stars,1,Normal Time,18532,Buffalo Sabres,Played,1.77,4.3,4.05,-96.810706,32.791093,Dallas Stars vs Buffalo Sabres | 1 - 4 Normal Time | Winner: Buffalo Sabres
16/01/2020,2019/2020,Anaheim Ducks,4,Nashville Predators,2,Normal Time,17388,Anaheim Ducks,Played,1.81,4.45,3.85,-86.778458,36.159125,Nashville Predators vs Anaheim Ducks | 2 - 4 Normal Time | Winner: Anaheim Ducks
16/01/2020,2019/2020,New Jersey Devils,2,Washington Capitals,5,Normal Time,18573,Washington Capitals,Played,1.51,5.3,5.35,-77.021903,38.898147,Washington Capitals vs New Jersey Devils | 5 - 2 Normal Time | Winner: Washington Capitals
16/01/2020,2019/2020,San Jose Sharks,0,Colorado Avalanche,4,Normal Time,18014,Colorado Avalanche,Played,1.71,4.65,4.15,-105.008479,39.74822,Colorado Avalanche vs San Jose Sharks | 4 - 0 Normal Time | Winner: Colorado Avalanche
16/01/2020,2019/2020,Montreal Canadiens,4,Philadelphia Flyers,1,Normal Time,17377,Montreal Canadiens,Played,2.19,4.45,2.8,-75.171967,39.90041,Philadelphia Flyers vs Montreal Canadiens | 1 - 4 Normal Time | Winner: Montreal Canadiens
16/01/2020,2019/2020,Carolina Hurricanes,2,Columbus Blue Jackets,3,Normal Time,17900,Columbus Blue Jackets,Played,2.92,4.15,2.23,-83.006102,39.96904,Columbus Blue Jackets vs Carolina Hurricanes | 3 - 2 Normal Time | Winner: Columbus Blue Jackets
16/01/2020,2019/2020,Pittsburgh Penguins,1,Boston Bruins,4,Normal Time,17850,Boston Bruins,Played,2.25,4.33,2.75,-71.062106,42.366179,Boston Bruins vs Pittsburgh Penguins | 4 - 1 Normal Time | Winner: Boston Bruins
16/01/2020,2019/2020,Calgary Flames,2,Toronto Maple Leafs,1,SO,19462,Calgary Flames,Played,2.05,4.4,3.1,-79.379026,43.64341,Toronto Maple Leafs vs Calgary Flames | 1 - 2 SO | Winner: Calgary Flames
16/01/2020,2019/2020,Tampa Bay Lightning,2,Minnesota Wild,3,Normal Time,17305,Minnesota Wild,Played,3.13,4.45,2.01,-93.102168,44.944905,Minnesota Wild vs Tampa Bay Lightning | 3 - 2 Normal Time | Winner: Minnesota Wild
16/01/2020,2019/2020,Vegas Golden Knights,4,Ottawa Setors,2,Normal Time,12412,Vegas Golden Knights,Played,3.68,4.55,1.87,-75.927207,45.296899,Ottawa Setors vs Vegas Golden Knights | 2 - 4 Normal Time | Winner: Vegas Golden Knights
16/01/2020,2019/2020,Arizona Coyotes,1,Vancouver Canucks,3,Normal Time,18871,Vancouver Canucks,Played,2.43,3.98,2.65,-123.108833,49.277821,Vancouver Canucks vs Arizona Coyotes | 3 - 1 Normal Time | Winner: Vancouver Canucks
17/01/2020,2019/2020,Anaheim Ducks,2,Carolina Hurricanes,1,OT,16913,Anaheim Ducks,Played,1.71,4.65,4.1,-78.721967,35.803306,Carolina Hurricanes vs Anaheim Ducks | 1 - 2 OT | Winner: Anaheim Ducks
17/01/2020,2019/2020,Pittsburgh Penguins,2,Detroit Red Wings,1,OT,19515,Pittsburgh Penguins,Played,4.5,5.1,1.67,-83.055271,42.341077,Detroit Red Wings vs Pittsburgh Penguins | 1 - 2 OT | Winner: Pittsburgh Penguins
17/01/2020,2019/2020,Tampa Bay Lightning,7,Winnipeg Jets,1,Normal Time,15325,Tampa Bay Lightning,Played,2.98,4.35,2.1,-97.143754,49.89259,Winnipeg Jets vs Tampa Bay Lightning | 1 - 7 Normal Time | Winner: Tampa Bay Lightning
18/01/2020,2019/2020,Buffalo Sabres,1,Nashville Predators,2,Normal Time,17729,Nashville Predators,Played,1.81,4.55,3.8,-86.778458,36.159125,Nashville Predators vs Buffalo Sabres | 2 - 1 Normal Time | Winner: Nashville Predators
18/01/2020,2019/2020,Los Angeles Kings,1,Philadelphia Flyers,4,Normal Time,19602,Philadelphia Flyers,Played,2,4.5,3.25,-75.171967,39.90041,Philadelphia Flyers vs Los Angeles Kings | 4 - 1 Normal Time | Winner: Philadelphia Flyers
18/01/2020,2019/2020,New Jersey Devils,0,Columbus Blue Jackets,5,Normal Time,18680,Columbus Blue Jackets,Played,1.88,4.45,3.6,-83.006102,39.96904,Columbus Blue Jackets vs New Jersey Devils | 5 - 0 Normal Time | Winner: Columbus Blue Jackets
18/01/2020,2019/2020,Washington Capitals,6,New York Islanders,4,Normal Time,13917,Washington Capitals,Played,1.8,4.6,3.84,-73.975334,40.682624,New York Islanders vs Washington Capitals | 4 - 6 Normal Time | Winner: Washington Capitals
18/01/2020,2019/2020,Florida Panthers,4,Detroit Red Wings,1,Normal Time,19231,Florida Panthers,Played,4.1,4.65,1.72,-83.055271,42.341077,Detroit Red Wings vs Florida Panthers | 1 - 4 Normal Time | Winner: Florida Panthers
18/01/2020,2019/2020,Chicago Blackhawks,6,Toronto Maple Leafs,2,Normal Time,19502,Chicago Blackhawks,Played,1.76,4.85,3.88,-79.379026,43.64341,Toronto Maple Leafs vs Chicago Blackhawks | 2 - 6 Normal Time | Winner: Chicago Blackhawks
18/01/2020,2019/2020,Vegas Golden Knights,4,Montreal Canadiens,5,SO,21302,Montreal Canadiens,Played,2.8,4.25,2.25,-73.56945,44.496067,Montreal Canadiens vs Vegas Golden Knights | 5 - 4 SO | Winner: Montreal Canadiens
18/01/2020,2019/2020,Dallas Stars,0,Minnesota Wild,7,Normal Time,18219,Minnesota Wild,Played,2.67,4.15,2.45,-93.102168,44.944905,Minnesota Wild vs Dallas Stars | 7 - 0 Normal Time | Winner: Minnesota Wild
18/01/2020,2019/2020,San Jose Sharks,1,Vancouver Canucks,4,Normal Time,18786,Vancouver Canucks,Played,2.1,4.5,3,-123.108833,49.277821,Vancouver Canucks vs San Jose Sharks | 4 - 1 Normal Time | Winner: Vancouver Canucks
19/01/2020,2019/2020,Columbus Blue Jackets,2,New York Rangers,1,Normal Time,17423,Columbus Blue Jackets,Played,2.2,4.33,2.84,-73.993455,40.750478,New York Rangers vs Columbus Blue Jackets | 1 - 2 Normal Time | Winner: Columbus Blue Jackets
19/01/2020,2019/2020,Winnipeg Jets,2,Chicago Blackhawks,5,Normal Time,21487,Chicago Blackhawks,Played,2.4,4.33,2.57,-87.674192,41.880666,Chicago Blackhawks vs Winnipeg Jets | 5 - 2 Normal Time | Winner: Chicago Blackhawks
20/01/2020,2019/2020,Florida Panthers,5,Minnesota Wild,4,Normal Time,17255,Florida Panthers,Played,2.45,4.05,2.56,-93.102168,44.944905,Minnesota Wild vs Florida Panthers | 4 - 5 Normal Time | Winner: Florida Panthers
21/01/2020,2019/2020,Winnipeg Jets,1,Carolina Hurricanes,4,Normal Time,14607,Carolina Hurricanes,Played,1.88,4.31,3.7,-78.721967,35.803306,Carolina Hurricanes vs Winnipeg Jets | 4 - 1 Normal Time | Winner: Carolina Hurricanes
21/01/2020,2019/2020,Pittsburgh Penguins,0,Philadelphia Flyers,3,Normal Time,19120,Philadelphia Flyers,Played,2.85,4.5,2.15,-75.171967,39.90041,Philadelphia Flyers vs Pittsburgh Penguins | 3 - 0 Normal Time | Winner: Philadelphia Flyers
21/01/2020,2019/2020,Florida Panthers,4,Chicago Blackhawks,3,Normal Time,21559,Florida Panthers,Played,2.31,4.95,2.68,-87.674192,41.880666,Chicago Blackhawks vs Florida Panthers | 3 - 4 Normal Time | Winner: Florida Panthers
21/01/2020,2019/2020,Vegas Golden Knights,2,Boston Bruins,3,Normal Time,17850,Boston Bruins,Played,2.05,4.4,3.11,-71.062106,42.366179,Boston Bruins vs Vegas Golden Knights | 3 - 2 Normal Time | Winner: Boston Bruins
22/01/2020,2019/2020,Winnipeg Jets,3,Columbus Blue Jackets,4,Normal Time,18425,Columbus Blue Jackets,Played,1.8,4.7,4.05,-83.006102,39.96904,Columbus Blue Jackets vs Winnipeg Jets | 4 - 3 Normal Time | Winner: Columbus Blue Jackets
22/01/2020,2019/2020,Detroit Red Wings,2,Minnesota Wild,4,Normal Time,17212,Minnesota Wild,Played,1.56,5.1,4.9,-93.102168,44.944905,Minnesota Wild vs Detroit Red Wings | 4 - 2 Normal Time | Winner: Minnesota Wild
27/01/2020,2019/2020,Tampa Bay Lightning,2,Dallas Stars,3,OT,18345,Dallas Stars,Played,2.88,4.25,2.21,-96.810706,32.791093,Dallas Stars vs Tampa Bay Lightning | 3 - 2 OT | Winner: Dallas Stars
27/01/2020,2019/2020,Toronto Maple Leafs,5,Nashville Predators,2,Normal Time,17298,Toronto Maple Leafs,Played,2.37,4.4,2.56,-86.778458,36.159125,Nashville Predators vs Toronto Maple Leafs | 2 - 5 Normal Time | Winner: Toronto Maple Leafs
27/01/2020,2019/2020,Anaheim Ducks,2,San Jose Sharks,4,Normal Time,16571,San Jose Sharks,Played,2.08,4.2,3.1,-121.901304,37.332713,San Jose Sharks vs Anaheim Ducks | 4 - 2 Normal Time | Winner: San Jose Sharks
27/01/2020,2019/2020,Washington Capitals,4,Montreal Canadiens,2,Normal Time,21302,Washington Capitals,Played,2.78,4.33,2.25,-73.56945,44.496067,Montreal Canadiens vs Washington Capitals | 2 - 4 Normal Time | Winner: Washington Capitals
27/01/2020,2019/2020,New Jersey Devils,4,Ottawa Setors,3,SO,9673,New Jersey Devils,Played,2.22,4.35,2.8,-75.927207,45.296899,Ottawa Setors vs New Jersey Devils | 3 - 4 SO | Winner: New Jersey Devils
27/01/2020,2019/2020,St. Louis Blues,1,Vancouver Canucks,3,Normal Time,18871,Vancouver Canucks,Played,2.82,4.25,2.22,-123.108833,49.277821,Vancouver Canucks vs St. Louis Blues | 3 - 1 Normal Time | Winner: Vancouver Canucks
28/01/2020,2019/2020,Ottawa Setors,5,Buffalo Sabres,2,Normal Time,16651,Ottawa Setors,Played,1.77,4.6,3.92,-78.876395,42.874951,Buffalo Sabres vs Ottawa Setors | 2 - 5 Normal Time | Winner: Ottawa Setors
28/01/2020,2019/2020,St. Louis Blues,5,Calgary Flames,4,SO,19033,St. Louis Blues,Played,2.4,4.1,2.69,-114.051939,51.037398,Calgary Flames vs St. Louis Blues | 4 - 5 SO | Winner: St. Louis Blues
29/01/2020,2019/2020,Toronto Maple Leafs,5,Dallas Stars,3,Normal Time,18532,Toronto Maple Leafs,Played,2.38,4.45,2.64,-96.810706,32.791093,Dallas Stars vs Toronto Maple Leafs | 3 - 5 Normal Time | Winner: Toronto Maple Leafs
29/01/2020,2019/2020,Arizona Coyotes,2,Anaheim Ducks,4,Normal Time,16730,Anaheim Ducks,Played,2.81,4.1,2.3,-117.876426,33.807714,Anaheim Ducks vs Arizona Coyotes | 4 - 2 Normal Time | Winner: Anaheim Ducks
29/01/2020,2019/2020,Tampa Bay Lightning,4,Los Angeles Kings,2,Normal Time,18230,Tampa Bay Lightning,Played,4.3,4.75,1.73,-118.267259,34.043004,Los Angeles Kings vs Tampa Bay Lightning | 2 - 4 Normal Time | Winner: Tampa Bay Lightning
29/01/2020,2019/2020,Vancouver Canucks,5,San Jose Sharks,2,Normal Time,16024,Vancouver Canucks,Played,2.41,4.25,2.55,-121.901304,37.332713,San Jose Sharks vs Vancouver Canucks | 2 - 5 Normal Time | Winner: Vancouver Canucks
29/01/2020,2019/2020,Nashville Predators,5,Washington Capitals,4,Normal Time,18573,Nashville Predators,Played,1.99,4.5,3.16,-77.021903,38.898147,Washington Capitals vs Nashville Predators | 4 - 5 Normal Time | Winner: Nashville Predators
29/01/2020,2019/2020,Calgary Flames,4,Edmonton Oilers,3,SO,18347,Calgary Flames,Played,2.29,4.4,2.8,-113.498029,53.546977,Edmonton Oilers vs Calgary Flames | 3 - 4 SO | Winner: Calgary Flames
30/01/2020,2019/2020,Los Angeles Kings,3,Arizona Coyotes,2,OT,13346,Los Angeles Kings,Played,1.93,4.45,3.51,-112.261173,33.532977,Arizona Coyotes vs Los Angeles Kings | 2 - 3 OT | Winner: Los Angeles Kings
30/01/2020,2019/2020,Nashville Predators,6,New Jersey Devils,5,SO,14327,Nashville Predators,Played,3.04,4.3,2.1,-74.171058,40.733511,New Jersey Devils vs Nashville Predators | 5 - 6 SO | Winner: Nashville Predators
30/01/2020,2019/2020,Montreal Canadiens,3,Buffalo Sabres,1,Normal Time,16604,Montreal Canadiens,Played,2.6,4.25,2.4,-78.876395,42.874951,Buffalo Sabres vs Montreal Canadiens | 1 - 3 Normal Time | Winner: Montreal Canadiens
31/01/2020,2019/2020,Tampa Bay Lightning,4,Anaheim Ducks,3,Normal Time,16032,Tampa Bay Lightning,Played,3.74,4.5,1.81,-117.876426,33.807714,Anaheim Ducks vs Tampa Bay Lightning | 3 - 4 Normal Time | Winner: Tampa Bay Lightning
31/01/2020,2019/2020,Vegas Golden Knights,4,Carolina Hurricanes,3,Normal Time,18150,Vegas Golden Knights,Played,2.15,4.33,2.98,-78.721967,35.803306,Carolina Hurricanes vs Vegas Golden Knights | 3 - 4 Normal Time | Winner: Vegas Golden Knights
31/01/2020,2019/2020,Philadelphia Flyers,3,Pittsburgh Penguins,4,OT,18647,Pittsburgh Penguins,Played,1.81,4.6,3.65,-79.989706,40.438823,Pittsburgh Penguins vs Philadelphia Flyers | 4 - 3 OT | Winner: Pittsburgh Penguins
31/01/2020,2019/2020,Detroit Red Wings,2,New York Rangers,4,Normal Time,17169,New York Rangers,Played,1.66,5.6,5.15,-73.993455,40.750478,New York Rangers vs Detroit Red Wings | 4 - 2 Normal Time | Winner: New York Rangers
31/01/2020,2019/2020,Washington Capitals,5,Ottawa Setors,3,Normal Time,14279,Washington Capitals,Played,3.86,5,1.71,-75.927207,45.296899,Ottawa Setors vs Washington Capitals | 3 - 5 Normal Time | Winner: Washington Capitals
31/01/2020,2019/2020,Boston Bruins,2,Winnipeg Jets,1,Normal Time,15325,Boston Bruins,Played,3.45,4.5,1.92,-97.143754,49.89259,Winnipeg Jets vs Boston Bruins | 1 - 2 Normal Time | Winner: Boston Bruins
31/01/2020,2019/2020,St. Louis Blues,2,Edmonton Oilers,4,Normal Time,17207,Edmonton Oilers,Played,2.72,4.35,2.3,-113.498029,53.546977,Edmonton Oilers vs St. Louis Blues | 4 - 2 Normal Time | Winner: Edmonton Oilers
1/02/2020,2019/2020,Chicago Blackhawks,3,Arizona Coyotes,2,SO,17125,Chicago Blackhawks,Played,2.13,4.25,2.94,-112.261173,33.532977,Arizona Coyotes vs Chicago Blackhawks | 2 - 3 SO | Winner: Chicago Blackhawks
1/02/2020,2019/2020,Anaheim Ducks,3,Los Angeles Kings,1,Normal Time,18230,Anaheim Ducks,Played,2.22,4.1,2.95,-118.267259,34.043004,Los Angeles Kings vs Anaheim Ducks | 1 - 3 Normal Time | Winner: Anaheim Ducks
1/02/2020,2019/2020,Vegas Golden Knights,3,Nashville Predators,0,Normal Time,17664,Vegas Golden Knights,Played,2.25,4.3,2.8,-86.778458,36.159125,Nashville Predators vs Vegas Golden Knights | 0 - 3 Normal Time | Winner: Vegas Golden Knights
