date,season,away_team.x,away_goals,home_team,home_goals,extra_time,attendance,winner,game_status,home_odds,tie_odds,away_odds,location_lon,location_lat,label_content
17/03/2019,2018/2019,Vegas Golden Knights,7,San Jose Sharks,3,Normal Time,17487,Vegas Golden Knights,Played,1.95,4.85,3.35,-121.901304,37.332713,San Jose Sharks vs Vegas Golden Knights | 3 - 7 Normal Time | Winner: Vegas Golden Knights
17/03/2019,2018/2019,Vancouver Canucks,3,Chicago Blackhawks,2,OT,21496,Vancouver Canucks,Played,1.65,5.15,4.4,-87.674192,41.880666,Chicago Blackhawks vs Vancouver Canucks | 2 - 3 OT | Winner: Vancouver Canucks
18/03/2019,2018/2019,Florida Panthers,2,Dallas Stars,4,Normal Time,17654,Dallas Stars,Played,2.1,4.33,3.15,-96.810706,32.791093,Dallas Stars vs Florida Panthers | 4 - 2 Normal Time | Winner: Dallas Stars
18/03/2019,2018/2019,Pittsburgh Penguins,2,Carolina Hurricanes,3,SO,14677,Carolina Hurricanes,Played,2.16,4.5,2.89,-78.721967,35.803306,Carolina Hurricanes vs Pittsburgh Penguins | 3 - 2 SO | Winner: Carolina Hurricanes
18/03/2019,2018/2019,Toronto Maple Leafs,0,Nashville Predators,3,Normal Time,17499,Nashville Predators,Played,2.27,4.5,2.74,-86.778458,36.159125,Nashville Predators vs Toronto Maple Leafs | 3 - 0 Normal Time | Winner: Nashville Predators
18/03/2019,2018/2019,Edmonton Oilers,2,St. Louis Blues,7,Normal Time,17873,St. Louis Blues,Played,1.71,4.6,4.25,-90.202834,38.626798,St. Louis Blues vs Edmonton Oilers | 7 - 2 Normal Time | Winner: St. Louis Blues
18/03/2019,2018/2019,Montreal Canadiens,3,Philadelphia Flyers,1,Normal Time,19045,Montreal Canadiens,Played,2.39,4.33,2.74,-75.171967,39.90041,Philadelphia Flyers vs Montreal Canadiens | 1 - 3 Normal Time | Winner: Montreal Canadiens
18/03/2019,2018/2019,Boston Bruins,5,New York Islanders,0,Normal Time,13917,Boston Bruins,Played,2.69,4.2,2.41,-73.975334,40.682624,New York Islanders vs Boston Bruins | 0 - 5 Normal Time | Winner: Boston Bruins
18/03/2019,2018/2019,Washington Capitals,4,New Jersey Devils,1,Normal Time,14815,Washington Capitals,Played,4.6,5,1.74,-74.171058,40.733511,New Jersey Devils vs Washington Capitals | 1 - 4 Normal Time | Winner: Washington Capitals
18/03/2019,2018/2019,Detroit Red Wings,3,New York Rangers,2,Normal Time,17183,Detroit Red Wings,Played,2.15,4.4,3.04,-73.993455,40.750478,New York Rangers vs Detroit Red Wings | 2 - 3 Normal Time | Winner: Detroit Red Wings
18/03/2019,2018/2019,Colorado Avalanche,3,Minnesota Wild,1,Normal Time,18785,Colorado Avalanche,Played,2.2,4.33,2.93,-93.102168,44.944905,Minnesota Wild vs Colorado Avalanche | 1 - 3 Normal Time | Winner: Colorado Avalanche
18/03/2019,2018/2019,Columbus Blue Jackets,2,Calgary Flames,4,Normal Time,18288,Calgary Flames,Played,2.16,4.5,2.95,-114.051939,51.037398,Calgary Flames vs Columbus Blue Jackets | 4 - 2 Normal Time | Winner: Calgary Flames
19/03/2019,2018/2019,Winnipeg Jets,3,Anaheim Ducks,0,Normal Time,16846,Winnipeg Jets,Played,3.04,4.5,2.13,-117.876426,33.807714,Anaheim Ducks vs Winnipeg Jets | 0 - 3 Normal Time | Winner: Winnipeg Jets
19/03/2019,2018/2019,Tampa Bay Lightning,5,Washington Capitals,4,OT,18506,Tampa Bay Lightning,Played,2.79,4.75,2.27,-77.021903,38.898147,Washington Capitals vs Tampa Bay Lightning | 4 - 5 OT | Winner: Tampa Bay Lightning
19/03/2019,2018/2019,Toronto Maple Leafs,4,Buffalo Sabres,2,Normal Time,19070,Toronto Maple Leafs,Played,3.14,4.6,2.1,-78.876395,42.874951,Buffalo Sabres vs Toronto Maple Leafs | 2 - 4 Normal Time | Winner: Toronto Maple Leafs
19/03/2019,2018/2019,Ottawa Setors,4,Vancouver Canucks,7,Normal Time,18500,Vancouver Canucks,Played,1.91,4.6,3.68,-123.108833,49.277821,Vancouver Canucks vs Ottawa Setors | 7 - 4 Normal Time | Winner: Vancouver Canucks
20/03/2019,2018/2019,Arizona Coyotes,2,Florida Panthers,4,Normal Time,12576,Florida Panthers,Played,2.25,4.33,2.86,-80.325378,26.158498,Florida Panthers vs Arizona Coyotes | 4 - 2 Normal Time | Winner: Florida Panthers
20/03/2019,2018/2019,Colorado Avalanche,3,Dallas Stars,1,Normal Time,17543,Colorado Avalanche,Played,2.13,4.33,3.15,-96.810706,32.791093,Dallas Stars vs Colorado Avalanche | 1 - 3 Normal Time | Winner: Colorado Avalanche
20/03/2019,2018/2019,San Jose Sharks,2,Los Angeles Kings,4,Normal Time,18230,Los Angeles Kings,Played,4.1,4.8,1.8,-118.267259,34.043004,Los Angeles Kings vs San Jose Sharks | 4 - 2 Normal Time | Winner: Los Angeles Kings
20/03/2019,2018/2019,Tampa Bay Lightning,6,Carolina Hurricanes,3,Normal Time,13785,Tampa Bay Lightning,Played,2.14,4.75,2.9,-78.721967,35.803306,Carolina Hurricanes vs Tampa Bay Lightning | 3 - 6 Normal Time | Winner: Tampa Bay Lightning
20/03/2019,2018/2019,Winnipeg Jets,0,Vegas Golden Knights,5,Normal Time,18430,Vegas Golden Knights,Played,1.9,4.75,3.54,-115.178408,36.102827,Vegas Golden Knights vs Winnipeg Jets | 5 - 0 Normal Time | Winner: Vegas Golden Knights
20/03/2019,2018/2019,Pittsburgh Penguins,2,Nashville Predators,1,SO,17729,Pittsburgh Penguins,Played,2.1,4.5,3.04,-86.778458,36.159125,Nashville Predators vs Pittsburgh Penguins | 1 - 2 SO | Winner: Pittsburgh Penguins
20/03/2019,2018/2019,Detroit Red Wings,2,St. Louis Blues,5,Normal Time,18272,St. Louis Blues,Played,1.47,5.5,6.15,-90.202834,38.626798,St. Louis Blues vs Detroit Red Wings | 5 - 2 Normal Time | Winner: St. Louis Blues
20/03/2019,2018/2019,Boston Bruins,5,New Jersey Devils,1,Normal Time,14649,Boston Bruins,Played,5.8,5.5,1.54,-74.171058,40.733511,New Jersey Devils vs Boston Bruins | 1 - 5 Normal Time | Winner: Boston Bruins
20/03/2019,2018/2019,Philadelphia Flyers,3,Chicago Blackhawks,1,Normal Time,21484,Philadelphia Flyers,Played,2.26,4.95,2.71,-87.674192,41.880666,Chicago Blackhawks vs Philadelphia Flyers | 1 - 3 Normal Time | Winner: Philadelphia Flyers
20/03/2019,2018/2019,Ottawa Setors,1,Calgary Flames,5,Normal Time,18793,Calgary Flames,Played,1.39,6,7.1,-114.051939,51.037398,Calgary Flames vs Ottawa Setors | 5 - 1 Normal Time | Winner: Calgary Flames
20/03/2019,2018/2019,Columbus Blue Jackets,1,Edmonton Oilers,4,Normal Time,18347,Edmonton Oilers,Played,2.84,4.5,2.23,-113.498029,53.546977,Edmonton Oilers vs Columbus Blue Jackets | 4 - 1 Normal Time | Winner: Edmonton Oilers
21/03/2019,2018/2019,San Jose Sharks,3,Anaheim Ducks,4,OT,17174,Anaheim Ducks,Played,2.96,4.7,2.15,-117.876426,33.807714,Anaheim Ducks vs San Jose Sharks | 4 - 3 OT | Winner: Anaheim Ducks
21/03/2019,2018/2019,Minnesota Wild,2,Washington Capitals,1,Normal Time,18506,Minnesota Wild,Played,1.9,4.6,3.78,-77.021903,38.898147,Washington Capitals vs Minnesota Wild | 1 - 2 Normal Time | Winner: Minnesota Wild
22/03/2019,2018/2019,Boston Bruins,7,Florida Panthers,3,Normal Time,17129,Boston Bruins,Played,2.97,4.5,2.15,-80.325378,26.158498,Florida Panthers vs Boston Bruins | 3 - 7 Normal Time | Winner: Boston Bruins
22/03/2019,2018/2019,Pittsburgh Penguins,3,Dallas Stars,2,Normal Time,18532,Pittsburgh Penguins,Played,2.42,4.33,2.63,-96.810706,32.791093,Dallas Stars vs Pittsburgh Penguins | 2 - 3 Normal Time | Winner: Pittsburgh Penguins
22/03/2019,2018/2019,Anaheim Ducks,3,Los Angeles Kings,4,SO,18230,Los Angeles Kings,Played,2.26,4.25,2.9,-118.267259,34.043004,Los Angeles Kings vs Anaheim Ducks | 4 - 3 SO | Winner: Los Angeles Kings
22/03/2019,2018/2019,Minnesota Wild,1,Carolina Hurricanes,5,Normal Time,16751,Carolina Hurricanes,Played,1.9,4.5,3.76,-78.721967,35.803306,Carolina Hurricanes vs Minnesota Wild | 5 - 1 Normal Time | Winner: Carolina Hurricanes
22/03/2019,2018/2019,Detroit Red Wings,3,Vegas Golden Knights,2,OT,18437,Detroit Red Wings,Played,1.44,5.65,6.05,-115.178408,36.102827,Vegas Golden Knights vs Detroit Red Wings | 2 - 3 OT | Winner: Detroit Red Wings
22/03/2019,2018/2019,Tampa Bay Lightning,3,St. Louis Blues,4,Normal Time,18127,St. Louis Blues,Played,2.49,4.5,2.5,-90.202834,38.626798,St. Louis Blues vs Tampa Bay Lightning | 4 - 3 Normal Time | Winner: St. Louis Blues
22/03/2019,2018/2019,Buffalo Sabres,4,Montreal Canadiens,7,Normal Time,21302,Montreal Canadiens,Played,1.78,4.95,3.9,-73.56945,44.496067,Montreal Canadiens vs Buffalo Sabres | 7 - 4 Normal Time | Winner: Montreal Canadiens
22/03/2019,2018/2019,Calgary Flames,3,Vancouver Canucks,1,Normal Time,18685,Calgary Flames,Played,3.4,4.75,1.94,-123.108833,49.277821,Vancouver Canucks vs Calgary Flames | 1 - 3 Normal Time | Winner: Calgary Flames
22/03/2019,2018/2019,Nashville Predators,0,Winnipeg Jets,5,Normal Time,15321,Winnipeg Jets,Played,2.49,4.33,2.6,-97.143754,49.89259,Winnipeg Jets vs Nashville Predators | 5 - 0 Normal Time | Winner: Winnipeg Jets
23/03/2019,2018/2019,Montreal Canadiens,1,Carolina Hurricanes,2,OT,14437,Carolina Hurricanes,Played,1.93,4.5,3.88,-78.721967,35.803306,Carolina Hurricanes vs Montreal Canadiens | 2 - 1 OT | Winner: Carolina Hurricanes
23/03/2019,2018/2019,Colorado Avalanche,1,Chicago Blackhawks,2,OT,21410,Chicago Blackhawks,Played,2.31,4.85,2.65,-87.674192,41.880666,Chicago Blackhawks vs Colorado Avalanche | 2 - 1 OT | Winner: Chicago Blackhawks
23/03/2019,2018/2019,Columbus Blue Jackets,5,Vancouver Canucks,0,Normal Time,17805,Columbus Blue Jackets,Played,3.55,4.6,1.94,-123.108833,49.277821,Vancouver Canucks vs Columbus Blue Jackets | 0 - 5 Normal Time | Winner: Columbus Blue Jackets
24/03/2019,2018/2019,Boston Bruins,4,Tampa Bay Lightning,5,Normal Time,19092,Tampa Bay Lightning,Played,2.04,4.6,3.22,-82.451804,27.942695,Tampa Bay Lightning vs Boston Bruins | 5 - 4 Normal Time | Winner: Tampa Bay Lightning
24/03/2019,2018/2019,Detroit Red Wings,3,San Jose Sharks,2,Normal Time,17393,Detroit Red Wings,Played,1.45,5.6,6.3,-121.901304,37.332713,San Jose Sharks vs Detroit Red Wings | 2 - 3 Normal Time | Winner: Detroit Red Wings
24/03/2019,2018/2019,Vegas Golden Knights,1,St. Louis Blues,3,Normal Time,18247,St. Louis Blues,Played,2.1,4.5,3.1,-90.202834,38.626798,St. Louis Blues vs Vegas Golden Knights | 3 - 1 Normal Time | Winner: St. Louis Blues
24/03/2019,2018/2019,Buffalo Sabres,1,New Jersey Devils,3,Normal Time,12053,New Jersey Devils,Played,2.6,4.55,2.42,-74.171058,40.733511,New Jersey Devils vs Buffalo Sabres | 3 - 1 Normal Time | Winner: New Jersey Devils
24/03/2019,2018/2019,Pittsburgh Penguins,5,New York Rangers,2,Normal Time,17401,Pittsburgh Penguins,Played,3.76,4.75,1.83,-73.993455,40.750478,New York Rangers vs Pittsburgh Penguins | 2 - 5 Normal Time | Winner: Pittsburgh Penguins
24/03/2019,2018/2019,Florida Panthers,5,Toronto Maple Leafs,7,Normal Time,19125,Toronto Maple Leafs,Played,1.75,5,3.95,-79.379026,43.64341,Toronto Maple Leafs vs Florida Panthers | 7 - 5 Normal Time | Winner: Toronto Maple Leafs
24/03/2019,2018/2019,Nashville Predators,1,Minnesota Wild,0,Normal Time,18833,Nashville Predators,Played,2.89,4.2,2.32,-93.102168,44.944905,Minnesota Wild vs Nashville Predators | 0 - 1 Normal Time | Winner: Nashville Predators
24/03/2019,2018/2019,Dallas Stars,5,Winnipeg Jets,2,Normal Time,15321,Dallas Stars,Played,2.13,4.33,3.1,-97.143754,49.89259,Winnipeg Jets vs Dallas Stars | 2 - 5 Normal Time | Winner: Dallas Stars
24/03/2019,2018/2019,Los Angeles Kings,3,Calgary Flames,0,Normal Time,18471,Los Angeles Kings,Played,1.53,5.65,5.6,-114.051939,51.037398,Calgary Flames vs Los Angeles Kings | 0 - 3 Normal Time | Winner: Los Angeles Kings
25/03/2019,2018/2019,Chicago Blackhawks,0,Arizona Coyotes,1,Normal Time,15055,Arizona Coyotes,Played,2.25,4.5,2.76,-112.261173,33.532977,Arizona Coyotes vs Chicago Blackhawks | 1 - 0 Normal Time | Winner: Arizona Coyotes
25/03/2019,2018/2019,Carolina Hurricanes,1,Washington Capitals,4,Normal Time,18506,Washington Capitals,Played,2.18,4.4,2.89,-77.021903,38.898147,Washington Capitals vs Carolina Hurricanes | 4 - 1 Normal Time | Winner: Washington Capitals
25/03/2019,2018/2019,Florida Panthers,1,Montreal Canadiens,6,Normal Time,21029,Montreal Canadiens,Played,1.85,4.75,3.6,-73.56945,44.496067,Montreal Canadiens vs Florida Panthers | 6 - 1 Normal Time | Winner: Montreal Canadiens
25/03/2019,2018/2019,Buffalo Sabres,0,Ottawa Setors,4,Normal Time,12074,Ottawa Setors,Played,2.69,4.4,2.3,-75.927207,45.296899,Ottawa Setors vs Buffalo Sabres | 4 - 0 Normal Time | Winner: Ottawa Setors
25/03/2019,2018/2019,Anaheim Ducks,5,Vancouver Canucks,4,Normal Time,17633,Anaheim Ducks,Played,2.24,4.2,2.95,-123.108833,49.277821,Vancouver Canucks vs Anaheim Ducks | 4 - 5 Normal Time | Winner: Anaheim Ducks
25/03/2019,2018/2019,Los Angeles Kings,4,Edmonton Oilers,8,Normal Time,18347,Edmonton Oilers,Played,1.83,4.75,3.72,-113.498029,53.546977,Edmonton Oilers vs Los Angeles Kings | 8 - 4 Normal Time | Winner: Edmonton Oilers
26/03/2019,2018/2019,Vegas Golden Knights,3,Colorado Avalanche,4,Normal Time,16799,Colorado Avalanche,Played,2.75,4.33,2.32,-105.008479,39.74822,Colorado Avalanche vs Vegas Golden Knights | 4 - 3 Normal Time | Winner: Colorado Avalanche
26/03/2019,2018/2019,Toronto Maple Leafs,4,Philadelphia Flyers,5,SO,19205,Philadelphia Flyers,Played,3,5.05,2.07,-75.171967,39.90041,Philadelphia Flyers vs Toronto Maple Leafs | 5 - 4 SO | Winner: Philadelphia Flyers
26/03/2019,2018/2019,Dallas Stars,2,Calgary Flames,1,Normal Time,18881,Dallas Stars,Played,2.06,4.33,3.22,-114.051939,51.037398,Calgary Flames vs Dallas Stars | 1 - 2 Normal Time | Winner: Dallas Stars
27/03/2019,2018/2019,Washington Capitals,3,Carolina Hurricanes,2,Normal Time,14680,Washington Capitals,Played,2.17,4.75,2.95,-78.721967,35.803306,Carolina Hurricanes vs Washington Capitals | 2 - 3 Normal Time | Winner: Washington Capitals
27/03/2019,2018/2019,Chicago Blackhawks,5,San Jose Sharks,4,Normal Time,17364,Chicago Blackhawks,Played,1.78,4.8,3.95,-121.901304,37.332713,San Jose Sharks vs Chicago Blackhawks | 4 - 5 Normal Time | Winner: Chicago Blackhawks
27/03/2019,2018/2019,Montreal Canadiens,2,Columbus Blue Jackets,6,Normal Time,18641,Columbus Blue Jackets,Played,2.09,4.33,3.16,-83.006102,39.96904,Columbus Blue Jackets vs Montreal Canadiens | 6 - 2 Normal Time | Winner: Columbus Blue Jackets
27/03/2019,2018/2019,Detroit Red Wings,5,Buffalo Sabres,4,OT,16236,Detroit Red Wings,Played,2.13,4.4,3.17,-78.876395,42.874951,Buffalo Sabres vs Detroit Red Wings | 4 - 5 OT | Winner: Detroit Red Wings
27/03/2019,2018/2019,Florida Panthers,5,Ottawa Setors,2,Normal Time,14230,Florida Panthers,Played,2.99,4.6,2.09,-75.927207,45.296899,Ottawa Setors vs Florida Panthers | 2 - 5 Normal Time | Winner: Florida Panthers
27/03/2019,2018/2019,Los Angeles Kings,2,Vancouver Canucks,3,SO,18524,Vancouver Canucks,Played,2.15,4.33,3.08,-123.108833,49.277821,Vancouver Canucks vs Los Angeles Kings | 3 - 2 SO | Winner: Vancouver Canucks
27/03/2019,2018/2019,Dallas Stars,3,Edmonton Oilers,2,SO,18347,Dallas Stars,Played,2.6,4.33,2.46,-113.498029,53.546977,Edmonton Oilers vs Dallas Stars | 2 - 3 SO | Winner: Dallas Stars
28/03/2019,2018/2019,Minnesota Wild,3,Vegas Golden Knights,2,Normal Time,18492,Minnesota Wild,Played,1.9,4.6,3.76,-115.178408,36.102827,Vegas Golden Knights vs Minnesota Wild | 2 - 3 Normal Time | Winner: Minnesota Wild
28/03/2019,2018/2019,Arizona Coyotes,2,Colorado Avalanche,3,SO,18045,Colorado Avalanche,Played,1.95,4.33,3.5,-105.008479,39.74822,Colorado Avalanche vs Arizona Coyotes | 3 - 2 SO | Winner: Colorado Avalanche
28/03/2019,2018/2019,Nashville Predators,3,Pittsburgh Penguins,1,Normal Time,18632,Nashville Predators,Played,2.2,4.4,2.9,-79.989706,40.438823,Pittsburgh Penguins vs Nashville Predators | 1 - 3 Normal Time | Winner: Nashville Predators
28/03/2019,2018/2019,St. Louis Blues,2,New York Rangers,4,Normal Time,17567,New York Rangers,Played,4.33,4.85,1.73,-73.993455,40.750478,New York Rangers vs St. Louis Blues | 4 - 2 Normal Time | Winner: New York Rangers
28/03/2019,2018/2019,New Jersey Devils,0,Detroit Red Wings,4,Normal Time,19515,Detroit Red Wings,Played,2.52,4.8,2.48,-83.055271,42.341077,Detroit Red Wings vs New Jersey Devils | 4 - 0 Normal Time | Winner: Detroit Red Wings
28/03/2019,2018/2019,Anaheim Ducks,1,Calgary Flames,6,Normal Time,19030,Calgary Flames,Played,1.72,4.85,4.9,-114.051939,51.037398,Calgary Flames vs Anaheim Ducks | 6 - 1 Normal Time | Winner: Calgary Flames
29/03/2019,2018/2019,Washington Capitals,6,Tampa Bay Lightning,3,Normal Time,19092,Washington Capitals,Played,1.87,4.8,3.45,-82.451804,27.942695,Tampa Bay Lightning vs Washington Capitals | 3 - 6 Normal Time | Winner: Washington Capitals
29/03/2019,2018/2019,Chicago Blackhawks,2,Los Angeles Kings,3,OT,18230,Los Angeles Kings,Played,2.85,4.4,2.25,-118.267259,34.043004,Los Angeles Kings vs Chicago Blackhawks | 3 - 2 OT | Winner: Los Angeles Kings
29/03/2019,2018/2019,Columbus Blue Jackets,5,Nashville Predators,2,Normal Time,17751,Columbus Blue Jackets,Played,2.42,4.33,2.66,-86.778458,36.159125,Nashville Predators vs Columbus Blue Jackets | 2 - 5 Normal Time | Winner: Columbus Blue Jackets
29/03/2019,2018/2019,Vegas Golden Knights,3,San Jose Sharks,4,OT,17562,San Jose Sharks,Played,2.09,4.5,3.02,-121.901304,37.332713,San Jose Sharks vs Vegas Golden Knights | 4 - 3 OT | Winner: San Jose Sharks
29/03/2019,2018/2019,Buffalo Sabres,1,New York Islanders,5,Normal Time,13917,New York Islanders,Played,1.74,4.6,4.3,-73.975334,40.682624,New York Islanders vs Buffalo Sabres | 5 - 1 Normal Time | Winner: New York Islanders
29/03/2019,2018/2019,St. Louis Blues,3,New Jersey Devils,2,OT,16514,St. Louis Blues,Played,4.3,4.7,1.83,-74.171058,40.733511,New Jersey Devils vs St. Louis Blues | 2 - 3 OT | Winner: St. Louis Blues
29/03/2019,2018/2019,Toronto Maple Leafs,2,Ottawa Setors,4,Normal Time,18655,Ottawa Setors,Played,4.1,5,1.72,-75.927207,45.296899,Ottawa Setors vs Toronto Maple Leafs | 4 - 2 Normal Time | Winner: Ottawa Setors
29/03/2019,2018/2019,Dallas Stars,2,Vancouver Canucks,3,SO,18663,Vancouver Canucks,Played,3.15,4.33,2.13,-123.108833,49.277821,Vancouver Canucks vs Dallas Stars | 3 - 2 SO | Winner: Vancouver Canucks
29/03/2019,2018/2019,Montreal Canadiens,3,Winnipeg Jets,1,Normal Time,15321,Montreal Canadiens,Played,2.09,4.4,3.1,-97.143754,49.89259,Winnipeg Jets vs Montreal Canadiens | 1 - 3 Normal Time | Winner: Montreal Canadiens
29/03/2019,2018/2019,Anaheim Ducks,5,Edmonton Oilers,1,Normal Time,18347,Anaheim Ducks,Played,2.02,4.55,3.22,-113.498029,53.546977,Edmonton Oilers vs Anaheim Ducks | 1 - 5 Normal Time | Winner: Anaheim Ducks
30/03/2019,2018/2019,Calgary Flames,5,San Jose Sharks,3,Normal Time,17313,Calgary Flames,Played,2.56,4.5,2.5,-121.901304,37.332713,San Jose Sharks vs Calgary Flames | 3 - 5 Normal Time | Winner: Calgary Flames
30/03/2019,2018/2019,Boston Bruins,3,Detroit Red Wings,6,Normal Time,19515,Detroit Red Wings,Played,4.1,5.05,1.77,-83.055271,42.341077,Detroit Red Wings vs Boston Bruins | 6 - 3 Normal Time | Winner: Detroit Red Wings
30/03/2019,2018/2019,Columbus Blue Jackets,4,Buffalo Sabres,0,Normal Time,17990,Columbus Blue Jackets,Played,4.05,4.75,1.75,-78.876395,42.874951,Buffalo Sabres vs Columbus Blue Jackets | 0 - 4 Normal Time | Winner: Columbus Blue Jackets
31/03/2019,2018/2019,Washington Capitals,3,Florida Panthers,5,Normal Time,14376,Florida Panthers,Played,2.8,5.05,2.25,-80.325378,26.158498,Florida Panthers vs Washington Capitals | 5 - 3 Normal Time | Winner: Florida Panthers
31/03/2019,2018/2019,Calgary Flames,7,Los Angeles Kings,2,Normal Time,18117,Calgary Flames,Played,2.7,4.33,2.38,-118.267259,34.043004,Los Angeles Kings vs Calgary Flames | 2 - 7 Normal Time | Winner: Calgary Flames
31/03/2019,2018/2019,Edmonton Oilers,1,Vegas Golden Knights,3,Normal Time,18367,Vegas Golden Knights,Played,1.77,4.8,4.33,-115.178408,36.102827,Vegas Golden Knights vs Edmonton Oilers | 3 - 1 Normal Time | Winner: Vegas Golden Knights
31/03/2019,2018/2019,Colorado Avalanche,2,St. Louis Blues,3,SO,17767,St. Louis Blues,Played,2,4.4,3.44,-90.202834,38.626798,St. Louis Blues vs Colorado Avalanche | 3 - 2 SO | Winner: St. Louis Blues
31/03/2019,2018/2019,Toronto Maple Leafs,2,New York Islanders,1,Normal Time,13917,Toronto Maple Leafs,Played,2.54,4.33,2.46,-73.975334,40.682624,New York Islanders vs Toronto Maple Leafs | 1 - 2 Normal Time | Winner: Toronto Maple Leafs
31/03/2019,2018/2019,Winnipeg Jets,4,Chicago Blackhawks,3,OT,21314,Winnipeg Jets,Played,2.65,4.5,2.33,-87.674192,41.880666,Chicago Blackhawks vs Winnipeg Jets | 3 - 4 OT | Winner: Winnipeg Jets
31/03/2019,2018/2019,Tampa Bay Lightning,5,Ottawa Setors,2,Normal Time,13628,Tampa Bay Lightning,Played,5,5.5,1.6,-75.927207,45.296899,Ottawa Setors vs Tampa Bay Lightning | 2 - 5 Normal Time | Winner: Tampa Bay Lightning
1/04/2019,2018/2019,Philadelphia Flyers,2,Dallas Stars,6,Normal Time,18532,Dallas Stars,Played,1.9,4.5,3.86,-96.810706,32.791093,Dallas Stars vs Philadelphia Flyers | 6 - 2 Normal Time | Winner: Dallas Stars
1/04/2019,2018/2019,Los Angeles Kings,3,Arizona Coyotes,1,Normal Time,14687,Los Angeles Kings,Played,1.72,4.4,4.4,-112.261173,33.532977,Arizona Coyotes vs Los Angeles Kings | 1 - 3 Normal Time | Winner: Los Angeles Kings
1/04/2019,2018/2019,Edmonton Oilers,2,Colorado Avalanche,6,Normal Time,17021,Colorado Avalanche,Played,1.83,4.75,4.1,-105.008479,39.74822,Colorado Avalanche vs Edmonton Oilers | 6 - 2 Normal Time | Winner: Colorado Avalanche
1/04/2019,2018/2019,Boston Bruins,6,Columbus Blue Jackets,2,Normal Time,18890,Boston Bruins,Played,2.2,4.4,3,-83.006102,39.96904,Columbus Blue Jackets vs Boston Bruins | 2 - 6 Normal Time | Winner: Boston Bruins
1/04/2019,2018/2019,Pittsburgh Penguins,1,Detroit Red Wings,4,Normal Time,19515,Detroit Red Wings,Played,3.82,4.75,1.83,-83.055271,42.341077,Detroit Red Wings vs Pittsburgh Penguins | 4 - 1 Normal Time | Winner: Detroit Red Wings
1/04/2019,2018/2019,Nashville Predators,3,Buffalo Sabres,2,Normal Time,16569,Nashville Predators,Played,4.05,4.6,1.8,-78.876395,42.874951,Buffalo Sabres vs Nashville Predators | 2 - 3 Normal Time | Winner: Nashville Predators
1/04/2019,2018/2019,Carolina Hurricanes,4,Toronto Maple Leafs,1,Normal Time,19097,Carolina Hurricanes,Played,2.58,4.4,2.41,-79.379026,43.64341,Toronto Maple Leafs vs Carolina Hurricanes | 1 - 4 Normal Time | Winner: Carolina Hurricanes
1/04/2019,2018/2019,Tampa Bay Lightning,2,Montreal Canadiens,4,Normal Time,21302,Montreal Canadiens,Played,2.33,4.4,2.65,-73.56945,44.496067,Montreal Canadiens vs Tampa Bay Lightning | 4 - 2 Normal Time | Winner: Montreal Canadiens
1/04/2019,2018/2019,Winnipeg Jets,1,Minnesota Wild,5,Normal Time,18590,Minnesota Wild,Played,2.25,4.33,2.9,-93.102168,44.944905,Minnesota Wild vs Winnipeg Jets | 5 - 1 Normal Time | Winner: Minnesota Wild
1/04/2019,2018/2019,San Jose Sharks,2,Vancouver Canucks,4,Normal Time,18524,Vancouver Canucks,Played,3.3,4.75,1.96,-123.108833,49.277821,Vancouver Canucks vs San Jose Sharks | 4 - 2 Normal Time | Winner: Vancouver Canucks
2/04/2019,2018/2019,Calgary Flames,1,Anaheim Ducks,3,Normal Time,17174,Anaheim Ducks,Played,3.25,4.5,2,-117.876426,33.807714,Anaheim Ducks vs Calgary Flames | 3 - 1 Normal Time | Winner: Anaheim Ducks
2/04/2019,2018/2019,Ottawa Setors,4,New York Rangers,1,Normal Time,16562,Ottawa Setors,Played,1.91,4.75,3.4,-73.993455,40.750478,New York Rangers vs Ottawa Setors | 1 - 4 Normal Time | Winner: Ottawa Setors
2/04/2019,2018/2019,St. Louis Blues,3,Chicago Blackhawks,4,SO,21482,Chicago Blackhawks,Played,3.35,4.6,2,-87.674192,41.880666,Chicago Blackhawks vs St. Louis Blues | 4 - 3 SO | Winner: Chicago Blackhawks
3/04/2019,2018/2019,New Jersey Devils,1,Carolina Hurricanes,3,Normal Time,17645,Carolina Hurricanes,Played,1.58,5.55,5.65,-78.721967,35.803306,Carolina Hurricanes vs New Jersey Devils | 3 - 1 Normal Time | Winner: Carolina Hurricanes
3/04/2019,2018/2019,Arizona Coyotes,4,Vegas Golden Knights,1,Normal Time,18485,Arizona Coyotes,Played,1.81,4.6,4,-115.178408,36.102827,Vegas Golden Knights vs Arizona Coyotes | 1 - 4 Normal Time | Winner: Arizona Coyotes
3/04/2019,2018/2019,Vancouver Canucks,2,Nashville Predators,3,Normal Time,17669,Nashville Predators,Played,1.63,4.75,4.75,-86.778458,36.159125,Nashville Predators vs Vancouver Canucks | 3 - 2 Normal Time | Winner: Nashville Predators
3/04/2019,2018/2019,Philadelphia Flyers,3,St. Louis Blues,7,Normal Time,18203,St. Louis Blues,Played,1.78,4.75,3.92,-90.202834,38.626798,St. Louis Blues vs Philadelphia Flyers | 7 - 3 Normal Time | Winner: St. Louis Blues
3/04/2019,2018/2019,Montreal Canadiens,1,Washington Capitals,2,Normal Time,18506,Washington Capitals,Played,2.15,4.5,2.95,-77.021903,38.898147,Washington Capitals vs Montreal Canadiens | 2 - 1 Normal Time | Winner: Washington Capitals
3/04/2019,2018/2019,Winnipeg Jets,2,Colorado Avalanche,3,OT,18003,Colorado Avalanche,Played,2.35,4.33,2.7,-105.008479,39.74822,Colorado Avalanche vs Winnipeg Jets | 3 - 2 OT | Winner: Colorado Avalanche
3/04/2019,2018/2019,Detroit Red Wings,1,Pittsburgh Penguins,4,Normal Time,18574,Pittsburgh Penguins,Played,1.55,5.95,5.15,-79.989706,40.438823,Pittsburgh Penguins vs Detroit Red Wings | 4 - 1 Normal Time | Winner: Pittsburgh Penguins
3/04/2019,2018/2019,Ottawa Setors,2,Buffalo Sabres,5,Normal Time,17988,Buffalo Sabres,Played,1.83,4.75,3.68,-78.876395,42.874951,Buffalo Sabres vs Ottawa Setors | 5 - 2 Normal Time | Winner: Buffalo Sabres
3/04/2019,2018/2019,Tampa Bay Lightning,3,Toronto Maple Leafs,1,Normal Time,19400,Tampa Bay Lightning,Played,2.56,4.6,2.4,-79.379026,43.64341,Toronto Maple Leafs vs Tampa Bay Lightning | 1 - 3 Normal Time | Winner: Tampa Bay Lightning
3/04/2019,2018/2019,Boston Bruins,3,Minnesota Wild,0,Normal Time,19074,Boston Bruins,Played,2.32,4.2,2.77,-93.102168,44.944905,Minnesota Wild vs Boston Bruins | 0 - 3 Normal Time | Winner: Boston Bruins
3/04/2019,2018/2019,San Jose Sharks,3,Edmonton Oilers,2,Normal Time,18347,San Jose Sharks,Played,2.98,4.75,2.09,-113.498029,53.546977,Edmonton Oilers vs San Jose Sharks | 2 - 3 Normal Time | Winner: San Jose Sharks
4/04/2019,2018/2019,Los Angeles Kings,2,Anaheim Ducks,5,Normal Time,17306,Anaheim Ducks,Played,2.03,4.33,3.42,-117.876426,33.807714,Anaheim Ducks vs Los Angeles Kings | 5 - 2 Normal Time | Winner: Anaheim Ducks
